title,price,star_rating,upc,product_type,price_excl_tax,price_incl_tax,tax,availability,number_reviews
"Don't Be a Jerk: And Other Practical Advice from Dogen, Japan's Greatest Zen Master",£37.97,2,fce19f9b4a943f22,Books,£37.97,£37.97,£0.00,In stock (16 available),0
You Are What You Love: The Spiritual Power of Habit,£21.87,4,796c87ddbbaaf8c5,Books,£21.87,£21.87,£0.00,In stock (15 available),0
God: The Most Unpleasant Character in All Fiction,£30.03,5,eec424a84c9e4c68,Books,£30.03,£30.03,£0.00,In stock (14 available),0
The Book of Mormon,£24.57,3,3f25a2fedae191cc,Books,£24.57,£24.57,£0.00,In stock (9 available),0
"A History of God: The 4,000-Year Quest of Judaism, Christianity, and Islam",£27.62,1,d12ca4020c2f602e,Books,£27.62,£27.62,£0.00,In stock (4 available),0
The Bhagavad Gita,£57.49,3,f3a0b8c835129558,Books,£57.49,£57.49,£0.00,In stock (1 available),0
Choosing Our Religion: The Spiritual Lives of America's Nones,£28.42,4,a812f6969ddf3e39,Books,£28.42,£28.42,£0.00,In stock (1 available),0
